{
  "$schema": "https://json-schema.org/draft/2020-12/schema",
  "$id": "https://example.org/schemas/ddbj_record.schema.json",
  "title": "DDBJ Record",
  "type": "object",
  "required": [
    "schema_version",
    "COMMON",
    "COMMON_SOURCE",
    "COMMON_META",
    "ENTRIES"
  ],
  "properties": {
    "schema_version": {
      "type": "string"
    },
    "COMMON": {
      "type": "object",
      "properties": {
        "DBLINK": {
          "type": "object",
          "properties": {
            "project": {
              "type": "string"
            },
            "biosample": {
              "type": "string"
            },
            "sequence read archive": {
              "type": "array",
              "items": {
                "type": "string"
              }
            }
          },
          "required": [
            "project",
            "biosample"
          ]
        },
        "SUBMITTER": {
          "type": "object",
          "properties": {
            "ab_name": {
              "type": "array",
              "items": {
                "type": "string"
              }
            },
            "contact": {
              "type": "string"
            },
            "email": {
              "type": "string",
              "format": "email"
            },
            "url": {
              "type": "string",
              "format": "uri"
            },
            "institute": {
              "type": "string"
            },
            "department": {
              "type": "string"
            },
            "country": {
              "type": "string"
            },
            "state": {
              "type": "string"
            },
            "city": {
              "type": "string"
            },
            "street": {
              "type": "string"
            },
            "zip": {
              "type": "string"
            }
          },
          "required": [
            "ab_name",
            "contact",
            "email"
          ]
        },
        "REFERENCE": {
          "type": "array",
          "items": {
            "type": "object",
            "properties": {
              "title": {
                "type": "string"
              },
              "ab_name": {
                "type": "array",
                "items": {
                  "type": "string"
                }
              },
              "status": {
                "type": "string"
              },
              "year": {
                "type": "string"
              }
            },
            "required": [
              "title",
              "ab_name",
              "status"
            ]
          }
        },
        "COMMENT": {
          "type": "array",
          "items": {
            "type": "object",
            "properties": {
              "line": {
                "type": "array",
                "items": {
                  "type": "string"
                }
              }
            },
            "required": [
              "line"
            ]
          }
        },
        "ST_COMMENT": {
          "type": "object",
          "properties": {
            "tagset_id": {
              "type": "string"
            },
            "Assembly Method": {
              "type": "string"
            },
            "Genome Coverage": {
              "type": "string"
            },
            "Sequencing Technology": {
              "type": "string"
            }
          },
          "required": [
            "tagset_id"
          ]
        },
        "DATE": {
          "type": "object",
          "properties": {
            "hold_date": {
              "type": "string",
              "pattern": "^\\d{8}$"
            }
          }
        },
        "trad_submission_category": {
          "type": "string"
        }
      }
    },
    "COMMON_SOURCE": {
      "type": "object",
      "properties": {
        "organism": {
          "type": "string"
        },
        "strain": {
          "type": "string"
        },
        "mol_type": {
          "type": "string"
        },
        "type_material": {
          "type": "string"
        },
        "collection_date": {
          "type": "string"
        },
        "culture_collection": {
          "type": "string"
        },
        "isolation_source": {
          "type": "string"
        },
        "geo_loc_name": {
          "type": "string"
        }
      }
    },
    "COMMON_META": {
      "type": "object",
      "properties": {
        "division": {
          "type": "string"
        },
        "locus_tag_prefix": {
          "type": "string"
        }
      },
      "required": [
        "division",
        "locus_tag_prefix"
      ]
    },
    "ENTRIES": {
      "type": "array",
      "items": {
        "type": "object",
        "required": [
          "id",
          "name",
          "type",
          "topology",
          "sequence",
          "features"
        ],
        "properties": {
          "id": {
            "type": "string"
          },
          "name": {
            "type": "string"
          },
          "type": {
            "type": "string"
          },
          "topology": {
            "type": "string"
          },
          "sequence": {
            "type": "string"
          },
          "features": {
            "type": "array",
            "items": {
              "type": "object",
              "required": [
                "id",
                "type",
                "location",
                "qualifiers"
              ],
              "properties": {
                "id": {
                  "type": "string"
                },
                "type": {
                  "type": "string"
                },
                "location": {
                  "type": "string"
                },
                "qualifiers": {
                  "type": "object",
                  "patternProperties": {
                    ".*": {
                      "type": "array",
                      "items": {
                        "type": "string"
                      }
                    }
                  }
                },
                "locus_tag_id": {
                  "type": "string"
                }
              }
            }
          }
        }
      }
    }
  }
}
